date,headline,source,summary
2025-08-08,Statement of Deviation and Variation,BSE,Statement Of Deviation And Variation
2025-08-08,Financial Results for the quarter ended 30.06.2025,BSE,Financial Results For The Quarter Ended 30.06.2025
2025-08-08,Analyst/Investor Presentation Q1FY26,BSE,Announcement under Regulation 30 (LODR)-Investor Presentation
2025-08-11,Newspaper Publication,BSE,Announcement under Regulation 30 (LODR)-Newspaper Publication
2025-08-12,"Investor interaction arranged by Emkay Global
Financial Services Limited.",BSE,Announcement under Regulation 30 (LODR)-Analyst / Investor Meet - Outcome
2025-08-12,Investor interaction organized by ICICI Securities,BSE,Announcement under Regulation 30 (LODR)-Analyst / Investor Meet - Intimation
2025-08-15,Upgrade in Credit Rating,BSE,Announcement under Regulation 30 (LODR)-Credit Rating
2025-08-16,Transcript of Analyst Meet,BSE,Announcement under Regulation 30 (LODR)-Analyst / Investor Meet - Outcome
2025-08-18,Investor interaction arranged by ICICI Securities,BSE,Announcement under Regulation 30 (LODR)-Analyst / Investor Meet - Outcome
2025-08-19,Investor interaction arranged by ICICI Securities,BSE,Announcement under Regulation 30 (LODR)-Analyst / Investor Meet - Outcome
2025-08-20,"Order of Add. Superintendent of Stamps, Gandhinagar",BSE,"Order Of Add. Superintendent Of Stamps, Gandhinagar"
2025-08-22,Newspaper Publication,BSE,Announcement under Regulation 30 (LODR)-Newspaper Publication
2025-08-28,Investor interaction organised by HSBC,BSE,Announcement under Regulation 30 (LODR)-Analyst / Investor Meet - Intimation
2025-08-30,Change in Senior Management,BSE,Announcement under Regulation 30 (LODR)-Change in Management
2025-09-02,Investor interaction organised by CLSA,BSE,Announcement under Regulation 30 (LODR)-Analyst / Investor Meet - Intimation
2025-09-02,Conclusion of Raising of Bonds under Regulation S,BSE,RAISING OF SENIOR/ UNSECURED/ FIXED RATE / REG S BOND
2025-09-02,Investor interaction organised by BofA,BSE,Announcement under Regulation 30 (LODR)-Analyst / Investor Meet - Intimation
2025-09-03,investor interaction arranged by HSBC,BSE,Announcement under Regulation 30 (LODR)-Analyst / Investor Meet - Outcome
2025-09-04,Investor interaction arranged by HSBC,BSE,Announcement under Regulation 30 (LODR)-Analyst / Investor Meet - Outcome
2025-09-09,Investor interaction arranged by Bank of America in Hong Kong,BSE,Announcement under Regulation 30 (LODR)-Analyst / Investor Meet - Outcome
2025-09-09,Investor interaction arranged by CLSA at Hong Kong,BSE,Announcement under Regulation 30 (LODR)-Analyst / Investor Meet - Outcome
2025-09-15,Investor interaction organised by Morgan Stanley,BSE,Announcement under Regulation 30 (LODR)-Analyst / Investor Meet - Intimation
2025-09-16,Investor interaction organised by J. P. Morgan,BSE,Announcement under Regulation 30 (LODR)-Analyst / Investor Meet - Intimation
2025-09-17,Change in Senior Management,BSE,Announcement under Regulation 30 (LODR)-Change in Management
2025-09-17,Divestment of stake in Yes Bank Limited,BSE,Divestment Of Stake In Yes Bank Limited (YBL) By State Bank Of India (SBI) To Sumitomo Mitsui Banking Corporation (SMBC)
2025-09-18,Investor interaction arranged by J. P. Morgan,BSE,Announcement under Regulation 30 (LODR)-Analyst / Investor Meet - Intimation
2025-09-18,Investor interaction arranged by Morgan Stanely,BSE,Announcement under Regulation 30 (LODR)-Analyst / Investor Meet - Outcome
2025-09-22,investor interaction arranged by J P Morgan,BSE,Announcement under Regulation 30 (LODR)-Analyst / Investor Meet - Outcome
2025-09-24,Investor interaction arranged by J P Morgan,BSE,Announcement under Regulation 30 (LODR)-Analyst / Investor Meet - Outcome
2025-09-29,Closure of Trading Window from 1st October 2025,BSE,Closure of Trading Window
2025-10-07,Newspaper Publication regarding special window for re-lodgement of transfer request of physical shares of SBI,BSE,Announcement under Regulation 30 (LODR)-Newspaper Publication
2025-10-09,Newspaper Publication regarding 100 days campaign - Saksham Viveshak,BSE,Announcement under Regulation 30 (LODR)-Newspaper Publication
2025-10-14,Disclosure regarding Ratings received from ICRA Limited and CARE Ratings Limited,BSE,Announcement under Regulation 30 (LODR)-Credit Rating
2025-10-14,"Certificate under Reg.74(5) of SEBI (DP) Regulations, 2018",BSE,"Compliances-Certificate under Reg. 74 (5) of SEBI (DP) Regulations, 2018"
2025-10-17,Tier 2 Bond raising - Bidding Updates,BSE,Tier 2 Bond Raising - Bidding Updates
2025-10-17,Press Release - Tier 2 Bond Issuance,BSE,Press Release - Tier 2 Bond Issuance
2025-10-18,"State Bank Of Indiahas informed BSE that the meeting of the Board of Directors of the Company is scheduled on 04/11/2025 ,inter alia, to consider and approve financial results for the quarter ....",BSE,Board Meeting Intimation for Considering Financial Results For The Quarter Ended 30.09.2025
2025-10-20,Disclosure regarding allotment of Bonds,BSE,Announcement under Regulation 30 (LODR)-Allotment
2025-10-29,Analyst Meet post Q2FY26 Results,BSE,Announcement under Regulation 30 (LODR)-Analyst / Investor Meet - Intimation
2025-10-30,Update on analyst meet,BSE,Announcement under Regulation 30 (LODR)-Analyst / Investor Meet - Intimation
2025-10-31,Change in Senior Management,BSE,Announcement under Regulation 30 (LODR)-Change in Management
2025-11-04,Financial Results for the quarter and half year ended 30.09.2025,BSE,Financial Results For The Quarter And Half Year Ended 30.09.2025
2025-11-04,Analysts Presentation,BSE,Announcement under Regulation 30 (LODR)-Investor Presentation
2025-11-04,Audio Recording of Post Earning Investor / Analyst Meeting,BSE,Announcement under Regulation 30 (LODR)-Analyst / Investor Meet - Outcome
2025-11-04,Statement of deviation or variation,BSE,Statement Of Deviation Or Variation
2025-11-04,Press Release Q2FY26 Results,BSE,Announcement under Regulation 30 (LODR)-Press Release / Media Release
2025-11-06,Sale of stake in SBI Funds Management Limited through IPO,BSE,Sale Of Stake In SBI Funds Management Limited Through IPO
2025-11-06,Newspaper Publication,BSE,Announcement under Regulation 30 (LODR)-Newspaper Publication
2025-11-06,Analysts meet organised ICICI Securities,BSE,Announcement under Regulation 30 (LODR)-Analyst / Investor Meet - Intimation
2025-11-06,Press Release on sale of stake in SBI Funds Management Limited through IPO,BSE,Announcement under Regulation 30 (LODR)-Press Release / Media Release
2025-11-11,Investors interaction arranged by ICICI Securities,BSE,Announcement under Regulation 30 (LODR)-Analyst / Investor Meet - Outcome
2025-11-12,Investor interaction organised by CLSA,BSE,Announcement under Regulation 30 (LODR)-Analyst / Investor Meet - Intimation
2025-11-12,Acquisition of stake in CareEdge Global IFSC Limited,BSE,Announcement under Regulation 30 (LODR)-Acquisition
2025-11-12,Investors interaction organised by HSBC,BSE,Announcement under Regulation 30 (LODR)-Analyst / Investor Meet - Intimation
2025-11-12,Investors interaction organised by Morgan Stanley,BSE,Announcement under Regulation 30 (LODR)-Analyst / Investor Meet - Intimation
2025-11-12,Transcript of Analyst Meet (Q2FY26) held on 04.11.2025,BSE,Announcement under Regulation 30 (LODR)-Analyst / Investor Meet - Outcome
2025-11-13,Acquisition of stake in Raajmarg Infra Investment Managers Pvt. Ltd.,BSE,Announcement under Regulation 30 (LODR)-Acquisition
2025-11-15,Newspaper Publications regarding transfer of shares to IEPF,BSE,Announcement under Regulation 30 (LODR)-Newspaper Publication
2025-11-15,Change in Statutory Central Auditors of the Bank,BSE,Announcement under Regulation 30 (LODR)-Appointment of Statutory Auditor/s
2025-11-17,Disclosure regarding outcome of investors interactions,BSE,Announcement under Regulation 30 (LODR)-Analyst / Investor Meet - Outcome
2025-11-19,Investor interaction arranged by Morgan Stanley,BSE,Announcement under Regulation 30 (LODR)-Analyst / Investor Meet - Outcome
2025-11-20,Investor interaction arranged by HSBC,BSE,Announcement under Regulation 30 (LODR)-Analyst / Investor Meet - Outcome
2025-11-21,Investor interaction arranged by HSBC,BSE,Announcement under Regulation 30 (LODR)-Analyst / Investor Meet - Outcome
2025-11-24,Schedule of analyst / investor meet,BSE,Announcement under Regulation 30 (LODR)-Analyst / Investor Meet - Intimation
2025-11-29,Change in Director/ Key Managerial Personnel/ Senior Management,BSE,Announcement under Regulation 30 (LODR)-Change in Management
2025-12-01,Investor interaction arranged by Macquarie Capital,BSE,Announcement under Regulation 30 (LODR)-Analyst / Investor Meet - Outcome
2025-12-01,Change in Key Managerial Personnel,BSE,Change In Key Managerial Personnel
2025-12-10,Investor interaction arranged by Citi,BSE,Announcement under Regulation 30 (LODR)-Analyst / Investor Meet - Intimation
2025-12-10,"RBI approval to establish a Section 8 company under Companies Act, 2013",BSE,"RBI Approval To Establish A Section 8 Company Under Companies Act, 2013"
2025-12-11,Subscription of shares of Indian Digital Payment Intelligence Corporation,BSE,Subscription Of Shares Of Indian Digital Payment Intelligence Corporation
2025-12-15,Disclosure regarding update on signing a EURO 150 million Line of Credit with KfW (German Development Bank) for financing Climate Friendly Energy Generation projects on 16.12.2025 at KfW ....,BSE,Update
2025-12-15,Disclosure regarding appointment of Shri Ravi Ranjan as the Managing Director of State Bank of India with effect from 15.12.2025,BSE,Announcement under Regulation 30 (LODR)-Change in Directorate
2025-12-16,Copy of newspaper Publications,BSE,Announcement under Regulation 30 (LODR)-Newspaper Publication
2025-12-16,Investors interaction arranged by Citi India,BSE,Announcement under Regulation 30 (LODR)-Analyst / Investor Meet - Outcome
2025-12-17,Extension of tenure of Managing Director,BSE,Announcement under Regulation 30 (LODR)-Change in Directorate
2025-12-29,Closure of Trading Window,BSE,Closure of Trading Window
2025-12-31,Change in Senior Management,BSE,Change In Senior Management
2026-05-05,NSE's profit falls 15% in FY26 as market activity moderates,NewsAPI,"A cooling derivatives market and a massive  ₹1,391-crore provision for Sebi settlements weighed on annual earnings, even as a strong March quarter provided a boost ahead of the exchange's planned IPO."
2026-05-06,Son rise at Sun: Decoding the architecture of Dilip Shanghvi’s global empire,NewsAPI,"With a bold $11.75 billion bet on Organon, Dilip Shanghvi is hedging a decade of US stagnation and quietly commissioning an empire for a son who would rather let the numbers do the talking."
2026-05-13,"Actis restarts Nxt-Infra sale process, appoints Ambit",NewsAPI,"Interest in road assets has been buoyant in India lately, driven by the availability of a large number of assets that attract large institutional investors, including pension and sovereign wealth funds."
2026-05-17,NSE's Electronic Gold Receipts: What are EGRs and what is in them for gold buyers?,NewsAPI,"EGRs give people the option to convert their physical gold into electronic format, hold it and enjoy the upside in gold prices, and later sell it or convert back to physical gold. The gold’s purity is assured and can be bought in small quantities of 100 milli…"
2026-05-21,"Mamaearth parent proposes ₹3-per-share dividend, its first ever, after record profit in Q4",NewsAPI,"The company will return nearly  ₹98 crore to shareholders as net profit surged 178% in the March quarter, driven by a record performance from younger brands like The Derma Co."
2026-05-22,"Wakefit flags margin pressure from input inflation, shares fall 7%",NewsAPI,Wakefit warned that a sharp rise in crude oil-linked input costs could weigh on margins and near-term profitability despite the recent price hikes—showing how elevated oil prices due to the Iran war-led disruptions are starting to squeeze consumer businesses …
2026-05-22,Mamaearth parent's shares jump 10% post-Q4 results; Jefferies sees firm 'on strong growth path',NewsAPI,Mamaearth parent's shares jump 10% post-Q4 results; Jefferies sees firm 'on strong growth path'moneycontrol.com
2026-05-24,Gold ETF vs EGR vs digital gold: What’s the smarter way to invest in yellow metal?,NewsAPI,"There are several ways to invest in gold, including Gold ETFs, Electronic Gold Receipts, and Digital Gold. But which option is best for regularly investing your surplus monthly income? Let’s explore."
2026-05-25,Top 5 silver ETFs by lowest tracking error that closely mirror silver prices,NewsAPI,Tracking error is one of the most important factors to check while choosing a silver ETF. It shows how closely an ETF follows the actual movement of silver prices. A lower tracking error means the ETF is doing a better job in mirroring silver prices.
2026-05-28,PhysicsWallah reins in K-12 ambitions as profitability takes priority,NewsAPI,The edtech major is sharpening its focus on profitability across its core online and offline education businesses.
