date,headline,source,summary
2024-01-02,Loss of share certificate,BSE,Compliances-Reg. 39 (3) - Details of Loss of Certificate / Duplicate Certificate
2024-01-03,Conclusion of Issuance of Syndicated Borrowing,BSE,Conclusion Of Issuance Of Syndicated Borrowing
2024-01-04,Conclusion of issuance of USD 1 billion through Syndicated Loan,BSE,Conclusion Of Issuance Of USD 1 Billion Through Syndicated Loan
2024-01-10,Issuance of USD 600 Mio Fixed Rate Senior Unsecured Notes,BSE,Issuance Of USD 600 Mio Fixed Rate Senior Unsecured Notes
2024-01-10,Certificate under Reg 74(5),BSE,"Compliances-Certificate under Reg. 74 (5) of SEBI (DP) Regulations, 2018"
2024-01-11,Loss of share certificate,BSE,Compliances-Reg. 39 (3) - Details of Loss of Certificate / Duplicate Certificate
2024-01-15,Newspaper Publication,BSE,Announcement under Regulation 30 (LODR)-Newspaper Publication
2024-01-15,Loss of share certificate,BSE,Compliances-Reg. 39 (3) - Details of Loss of Certificate / Duplicate Certificate
2024-01-17,"STATE BANK OF INDIAhas informed BSE that the meeting of the Board of Directors of the Company is scheduled on 03/02/2024 ,inter alia, to consider and approve financial results for the quarter ....",BSE,Board Meeting Intimation for Consideration Of Financial Results For The Quarter / Nine Months Ended 31.12.2023
2024-01-18,Disclosure under Regulation 30 - Press Release / Media Release,BSE,Announcement under Regulation 30 (LODR)-Press Release / Media Release
2024-01-18,General Updates on Bidding,BSE,General Updates On Bidding
2024-01-19,Allotment,BSE,Announcement under Regulation 30 (LODR)-Allotment
2024-01-20,Disclosure under Regulation 51 of SEBI LODR Regulations 2015,BSE,Disclosure Under Regulation 51 Of SEBI LODR Regulations 2015
2024-01-20,Updates on acquisition of shares of Canpac Trends Pvt. Ltd.,BSE,Updates On Acquisition Of Shares Of Canpac Trends Pvt. Ltd.
2024-01-20,Loss share certificate,BSE,Compliances-Reg. 39 (3) - Details of Loss of Certificate / Duplicate Certificate
2024-01-23,Analyst/ Investor Meet,BSE,Announcement under Regulation 30 (LODR)-Analyst / Investor Meet - Intimation
2024-01-25,Change in Senior Management,BSE,Change In Senior Management
2024-01-31,Analyst/ Investor Meet,BSE,Announcement under Regulation 30 (LODR)-Analyst / Investor Meet - Intimation
2024-01-31,Modalities of Analyst Meet,BSE,Announcement under Regulation 30 (LODR)-Analyst / Investor Meet - Intimation
2024-01-31,Change in Senior Management,BSE,Change In Senior Management
2024-02-01,Details of loss certificates,BSE,Compliances-Reg. 39 (3) - Details of Loss of Certificate / Duplicate Certificate
2024-02-01,Newspaper Publication,BSE,Announcement under Regulation 30 (LODR)-Newspaper Publication
2024-02-03,"Financial Results for the quarter and nine months ended December 31, 2023.",BSE,"Financial Results For Quarter And Nine Months Ended December 31, 2023"
2024-02-03,"Press Release for Financial Results for the quarter and nine months ended December 31, 2023.",BSE,Announcement under Regulation 30 (LODR)-Press Release / Media Release
2024-02-03,Analyst Meet Presentation - Q3FY24,BSE,Announcement under Regulation 30 (LODR)-Investor Presentation
2024-02-03,Statement of deviation & variation-31/12/2023,BSE,Statement Of Deviation & Variation-31/12/2023
2024-02-03,Analysts meet audio recording link.,BSE,Announcement under Regulation 30 (LODR)-Analyst / Investor Meet - Outcome
2024-02-06,Newspaper publication of financial results for Q3FY24.,BSE,Announcement under Regulation 30 (LODR)-Newspaper Publication
2024-02-06,Update on acquisition,BSE,Board Meeting Outcome for Update On Acquisition On The Entire Stake Of SBICAP Ventures Ltd. By SBI
2024-02-06,Investor  meeting arranged by Kotak Securities,BSE,Announcement under Regulation 30 (LODR)-Analyst / Investor Meet - Outcome
2024-02-07,One on One interaction,BSE,Announcement under Regulation 30 (LODR)-Analyst / Investor Meet - Outcome
2024-02-08,"The Exchange has sought clarification from State Bank of India on February 8, 2024, with reference to news appeared in www.moneycontrol.com dated February 8, 2024 quoting ""SBI likely to ....",BSE,Clarification sought from State Bank of India
2024-02-08,Clarification on news item appeared in www.moneycontrol.com,BSE,Clarification/ Confirmation On News Item Appearing In 'Media/Publication'.
2024-02-08,One on One Meeting,BSE,Announcement under Regulation 30 (LODR)-Analyst / Investor Meet - Outcome
2024-02-08,NJM Vencap,BSE,Announcement under Regulation 30 (LODR)-Analyst / Investor Meet - Intimation
2024-02-08,Transcript of Analyst Meeting dated 03.02.2024,BSE,Announcement under Regulation 30 (LODR)-Analyst / Investor Meet - Outcome
2024-02-12,Group Meeting arranged by Nuvama,BSE,Announcement under Regulation 30 (LODR)-Analyst / Investor Meet - Outcome
2024-02-14,Newspaper Publication,BSE,Announcement under Regulation 30 (LODR)-Newspaper Publication
2024-02-14,One on One interaction,BSE,Announcement under Regulation 30 (LODR)-Analyst / Investor Meet - Outcome
2024-02-14,Details of loss of share certificate,BSE,Compliances-Reg. 39 (3) - Details of Loss of Certificate / Duplicate Certificate
2024-02-14,Investor interaction organised by IIFL,BSE,Announcement under Regulation 30 (LODR)-Analyst / Investor Meet - Outcome
2024-02-15,Investor interaction organised by Axis Capital,BSE,Announcement under Regulation 30 (LODR)-Analyst / Investor Meet - Outcome
2024-02-15,One on One interaction,BSE,Announcement under Regulation 30 (LODR)-Analyst / Investor Meet - Outcome
2024-02-20,Interaction organised by Antique,BSE,Announcement under Regulation 30 (LODR)-Analyst / Investor Meet - Outcome
2024-02-20,Details of loss of share certificate,BSE,Compliances-Reg. 39 (3) - Details of Loss of Certificate / Duplicate Certificate
2024-02-20,Intimation under Regulation 15(6) and 15(7) of SEBI NCS Regulations 2021,BSE,Intimation Under Regulation 15(6) And 15(7) Of SEBI NCS Regulations 2021
2024-02-21,Interaction organised by HSBC,BSE,Announcement under Regulation 30 (LODR)-Analyst / Investor Meet - Intimation
2024-02-21,Investor Interaction organized by NJM Vencap,BSE,Announcement under Regulation 30 (LODR)-Analyst / Investor Meet - Outcome
2024-02-22,Investor interaction organised by Kotak Securities Ltd.,BSE,Announcement under Regulation 30 (LODR)-Analyst / Investor Meet - Outcome
2024-02-23,Details of loss of share certificate,BSE,Compliances-Reg. 39 (3) - Details of Loss of Certificate / Duplicate Certificate
2024-02-26,Investor Interaction organised by HSBC,BSE,Announcement under Regulation 30 (LODR)-Analyst / Investor Meet - Outcome
2024-02-26,Loss of share certificate,BSE,Compliances-Reg. 39 (3) - Details of Loss of Certificate / Duplicate Certificate
2024-02-26,Monetary Penalty Order by Reserve Bank of India,BSE,"Announcement Under Regulation 30 Of SEBI (LODR), 2015"
2024-02-26,Organised by BofA Securities,BSE,Announcement under Regulation 30 (LODR)-Analyst / Investor Meet - Intimation
2024-02-26,Organised by Morgan Stanley,BSE,Announcement under Regulation 30 (LODR)-Analyst / Investor Meet - Intimation
2024-02-26,Organised by JM Financial,BSE,Announcement under Regulation 30 (LODR)-Analyst / Investor Meet - Intimation
2024-02-26,Organised by Jefferies,BSE,Announcement under Regulation 30 (LODR)-Analyst / Investor Meet - Intimation
2024-02-27,Newspaper publication regarding loss of share certificates,BSE,Announcement under Regulation 30 (LODR)-Newspaper Publication
2024-02-27,Details loss of Share Certificate,BSE,Compliances-Reg. 39 (3) - Details of Loss of Certificate / Duplicate Certificate
2024-02-29,Organized by JM Financial,BSE,Announcement under Regulation 30 (LODR)-Analyst / Investor Meet - Outcome
2024-03-02,Newspaper publication,BSE,Announcement under Regulation 30 (LODR)-Newspaper Publication
2024-03-06,Loss of share certificate,BSE,Compliances-Reg. 39 (3) - Details of Loss of Certificate / Duplicate Certificate
2024-03-07,Credit Opinion Update,BSE,Credit Opinion Update
2024-03-12,Investor Meet organised by Jefferies,BSE,Announcement under Regulation 30 (LODR)-Analyst / Investor Meet - Outcome
2024-03-13,Cancellation of Investor Interaction,BSE,Announcement under Regulation 30 (LODR)-Analyst / Investor Meet - Outcome
2024-03-14,Loss of Share Certificate,BSE,Compliances-Reg. 39 (3) - Details of Loss of Certificate / Duplicate Certificate
2024-03-14,Newspaper Publication,BSE,Announcement under Regulation 30 (LODR)-Newspaper Publication
2024-03-15,Cancellation of Investor Interaction,BSE,Announcement under Regulation 30 (LODR)-Analyst / Investor Meet - Outcome
2024-03-16,Intimation of loss of share certificate,BSE,Compliances-Reg. 39 (3) - Details of Loss of Certificate / Duplicate Certificate
2024-03-28,Closure of Trading Window Q4-2024,BSE,Closure of Trading Window
2024-03-28,Details of loss of share certificate,BSE,Compliances-Reg. 39 (3) - Details of Loss of Certificate / Duplicate Certificate
2024-03-30,Intimation of loss of Share Certificates,BSE,Compliances-Reg. 39 (3) - Details of Loss of Certificate / Duplicate Certificate
2024-03-30,Newspaper Publication regarding loss of share certificates,BSE,Announcement under Regulation 30 (LODR)-Newspaper Publication
2024-04-03,Loss of Share Certificate,BSE,Compliances-Reg. 39 (3) - Details of Loss of Certificate / Duplicate Certificate
2024-04-04,compliance certificate under regulation 7(3),BSE,Compliance Certificate U/R 7(3)
2024-04-04,Compliance Certificate under Reg 74(5),BSE,"Compliances-Certificate under Reg. 74 (5) of SEBI (DP) Regulations, 2018"
2024-04-06,Newspaper Publication,BSE,Announcement under Regulation 30 (LODR)-Newspaper Publication
2024-04-06,Details of loss of certificate / duplicate certificate,BSE,Compliances-Reg. 39 (3) - Details of Loss of Certificate / Duplicate Certificate
2024-04-08,Details of loss of share certificate / duplicate certificate,BSE,Compliances-Reg. 39 (3) - Details of Loss of Certificate / Duplicate Certificate
2024-04-15,S&P Credit Rating,BSE,Announcement under Regulation 30 (LODR)-Credit Rating
2024-04-16,Credit Rating Fitch,BSE,Announcement under Regulation 30 (LODR)-Credit Rating
2024-04-18,Newspaper Publication,BSE,Announcement under Regulation 30 (LODR)-Newspaper Publication
2024-04-18,Loss of Share Certificates,BSE,Compliances-Reg. 39 (3) - Details of Loss of Certificate / Duplicate Certificate
2024-04-20,Details of loss of share certificate,BSE,Compliances-Reg. 39 (3) - Details of Loss of Certificate / Duplicate Certificate
2024-04-24,"Certificate under Regulation 40(10) of SEBI (LODR) Regulations, 2015",BSE,Compliances-Certificate Under Regulation 40(10) Of SEBI LODR
2024-04-29,Loss of Share Certificates,BSE,Compliances-Reg. 39 (3) - Details of Loss of Certificate / Duplicate Certificate
2024-05-01,"STATE BANK OF INDIAhas informed BSE that the meeting of the Board of Directors of the Company is scheduled on 09/05/2024 ,inter alia, to consider and approve In compliance with Regulation ....",BSE,"Board Meeting Intimation for Consideration Of The Financial Results Of The Bank For The Quarter/Year Ended 31St March, 2024. 

2. The Central Board Of The Bank May Also Consider Declaration Of Dividend, If Any, For The FY 2023-24."
2024-05-01,Analyst Meet,BSE,Announcement under Regulation 30 (LODR)-Analyst / Investor Meet - Intimation
2024-05-06,Analyst/ Investors'' Meet Updates,BSE,Announcement under Regulation 30 (LODR)-Analyst / Investor Meet - Intimation
2024-05-08,Newspaper Publication,BSE,Announcement under Regulation 30 (LODR)-Newspaper Publication
2024-05-08,Details of loss of share certificate,BSE,Compliances-Reg. 39 (3) - Details of Loss of Certificate / Duplicate Certificate
2024-05-09,Outcome of Board Meeting dated 09.05.2024,BSE,Board Meeting Outcome for Outcome Of Board Meeting Dated 09.05.2024
2024-05-09,Audited Financial Results for the quarter and year ended 31.03.2024,BSE,Audited Financial Results For The Quarter And Year Ended 31.03.2024
2024-05-09,Investor Presentation,BSE,Announcement under Regulation 30 (LODR)-Investor Presentation
2024-05-09,Press Release Q4 FY24,BSE,Announcement under Regulation 30 (LODR)-Press Release / Media Release
2024-05-09,Statement of Related Party Transaction,BSE,Statement Of Related Party Transaction
2024-05-09,Central Board of the Bank has declared Dividend of Rs. 13.70 per equity share,BSE,Corporate Action-Board approves Dividend
2024-05-09,"Record Date: 22.05.2024
Book Closure: 23.05.2024 to 25.05.2024",BSE,Record Date On 22.05.2024 And Book Closure From 23.05.2024 To 25.05.2024
2024-05-09,Group Meeting organised by BofA Securities,BSE,Announcement under Regulation 30 (LODR)-Analyst / Investor Meet - Intimation
2024-05-09,Outcome of Analyst Meet,BSE,Announcement under Regulation 30 (LODR)-Analyst / Investor Meet - Outcome
2024-05-09,Book Closure from 23.05.2024 to 25.03.2024,BSE,Book Closure From 23.05.2024 To 25.03.2024
2024-05-09,Reg 32: Statement of Deviation and Variation,BSE,Statement Of Deviation And Variation
2024-05-11,Financial results publication,BSE,Announcement under Regulation 30 (LODR)-Newspaper Publication
2024-05-13,Press Release regarding Trading cum clearing Member of IIBX,BSE,Announcement under Regulation 30 (LODR)-Press Release / Media Release
2024-05-15,Newspaper publication for Dividend,BSE,Announcement under Regulation 30 (LODR)-Newspaper Publication
2024-05-15,Details of loss of share certificate,BSE,Compliances-Reg. 39 (3) - Details of Loss of Certificate / Duplicate Certificate
2024-05-15,Group meeting organised by Elara Capita,BSE,Announcement under Regulation 30 (LODR)-Analyst / Investor Meet - Intimation
2024-05-16,Transcript of Analyst Meet dated 09.05.2024,BSE,Announcement under Regulation 30 (LODR)-Analyst / Investor Meet - Outcome
2024-05-16,Secretarial Compliance Report for the year ended 31.03.2024,BSE,Compliances-Reg.24(A)-Annual Secretarial Compliance
2024-05-17,Acquisition of stake in CCIL IFSC Limited,BSE,Announcement under Regulation 30 (LODR)-Acquisition
2024-05-17,Investor Interaction arranged by BofA Securities,BSE,Announcement under Regulation 30 (LODR)-Analyst / Investor Meet - Outcome
2024-05-18,Loss of share certificate,BSE,Compliances-Reg. 39 (3) - Details of Loss of Certificate / Duplicate Certificate
2024-05-18,Newspaper publication,BSE,Announcement under Regulation 30 (LODR)-Newspaper Publication
2024-05-20,69th Annual General Meeting scheduled to be held on 19th June 2024,BSE,Annual General Meeting: 19Th June 2024
2024-05-21,Investor interaction organized by Elara Capital,BSE,Announcement under Regulation 30 (LODR)-Analyst / Investor Meet - Outcome
2024-05-21,Notice of AGM,BSE,Announcement under Regulation 30 (LODR)-Newspaper Publication
2024-05-24,Monetary Penalty Order,BSE,Penalty Order :South African Reserve Bank Prudential Authority
2024-05-24,Loss of Share Certificate,BSE,Compliances-Reg. 39 (3) - Details of Loss of Certificate / Duplicate Certificate
2024-05-27,Annual Report for the year 2023-24,BSE,Reg. 34 (1) Annual Report.
2024-05-27,Organised by HSBC,BSE,Announcement under Regulation 30 (LODR)-Analyst / Investor Meet - Intimation
2024-05-27,Business Responsibility and Sustainability Report for FY 2023-24,BSE,Business Responsibility and Sustainability Reporting (BRSR)
2024-05-28,Change in Senior Management,BSE,Announcement Under Regulation 30 Of SEBI LODR- Change In Senior Management
2024-05-28,Dispatch of Annual Report for FY 2023-24 and Notice of 69th AGM,BSE,Announcement under Regulation 30 (LODR)-Newspaper Publication
2024-05-29,Rating by S&P Global Ratings,BSE,Announcement under Regulation 30 (LODR)-Credit Rating
2024-05-31,Call option notice sent to bondholders,BSE,Call Option Notice Sent To Bondholders
2024-05-31,Investor Interaction by HSBC,BSE,Announcement under Regulation 30 (LODR)-Analyst / Investor Meet - Outcome
2024-05-31,Change in Senior Management,BSE,Announcement Under Regulation 30 Of SEBI (LODR) - Change In Senior Management
2024-06-01,Details of loss of share certificate,BSE,Compliances-Reg. 39 (3) - Details of Loss of Certificate / Duplicate Certificate
2024-06-03,Loss of share certificate,BSE,Compliances-Reg. 39 (3) - Details of Loss of Certificate / Duplicate Certificate
2024-06-03,Details of loss / duplicate share certificate,BSE,Announcement under Regulation 30 (LODR)-Newspaper Publication
2024-06-04,"STATE BANK OF INDIAhas informed BSE that the meeting of the Board of Directors of the Company is scheduled on 11/06/2024 ,inter alia, to consider and approve long term fund raising in single ....",BSE,Board Meeting Intimation for Long Term Fund Raising Upto US$ 3 Billion
2024-06-11,Long term fund raising in single / multiple tranches of upto US$ 3 billion,BSE,Board Meeting Outcome for Long Term Fund Raising Of Upto US$ 3 Billion
2024-06-12,"STATE BANK OF INDIAhas informed BSE that the meeting of the Board of Directors of the Company is scheduled on 19/06/2024 ,inter alia, to consider and approve To seek approval for raising ....",BSE,Board Meeting Intimation for To Seek Approval For Raising Of Long Term Bonds
2024-06-14,Loss of share certificate,BSE,Announcement under Regulation 30 (LODR)-Newspaper Publication
2024-06-14,Details of loss of share certificate,BSE,Compliances-Reg. 39 (3) - Details of Loss of Certificate / Duplicate Certificate
2024-06-14,Issuance of USD 100 Mio senior unsecured floating rate notes,BSE,Issuance Of USD 100 Mio Senior Unsecured Floating Rate Notes
2024-06-19,Raising of long term bonds,BSE,Board Meeting Outcome for Raising Of Long Term Bonds
2024-06-19,Proceedings of AGM and Scrutinizer''s Report,BSE,Shareholder Meeting / Postal Ballot-Scrutinizer''s Report
2024-06-20,Loss of Share Certificate,BSE,Compliances-Reg. 39 (3) - Details of Loss of Certificate / Duplicate Certificate
2024-06-22,Rating by ICRA,BSE,Announcement under Regulation 30 (LODR)-Credit Rating
2024-06-22,Rating by India Ratings,BSE,Announcement under Regulation 30 (LODR)-Credit Rating
2024-06-24,69th AGM dated 19th June 2024,BSE,69Th Annual General Meeting
2024-06-25,Loss of Share Certificate,BSE,Compliances-Reg. 39 (3) - Details of Loss of Certificate / Duplicate Certificate
2024-06-26,Newspaper publication of loss of share certificate,BSE,Announcement under Regulation 30 (LODR)-Newspaper Publication
2024-06-26,Bank''s Senior Unsecured Long Term Bond issuance,BSE,Announcement under Regulation 30 (LODR)-Press Release / Media Release
2024-06-26,Issuance of long term bonds,BSE,Update On Bidding
2024-06-26,Details of loss of share certificate,BSE,Compliances-Reg. 39 (3) - Details of Loss of Certificate / Duplicate Certificate
2024-06-26,Senior Unsecured Long Term Bond Issuance,BSE,Announcement under Regulation 30 (LODR)-Press Release / Media Release (Revised)
2024-06-27,Newspaper publication of loss of share certificate,BSE,Announcement under Regulation 30 (LODR)-Newspaper Publication
2024-06-27,Allotment of long term bonds,BSE,Announcement under Regulation 30 (LODR)-Allotment
2024-06-27,Loss of Share Certificate,BSE,Compliances-Reg. 39 (3) - Details of Loss of Certificate / Duplicate Certificate
2024-06-28,Intimation of closure of trading window,BSE,Closure of Trading Window
2024-06-29,Change in Senior Management,BSE,Change In Senior Management
2024-06-29,Superannuation of the Managing Director Shri Alok Kumar Choudhary,BSE,Announcement under Regulation 30 (LODR)-Change in Directorate
2024-07-04,Details of loss of share certificate,BSE,Compliances-Reg. 39 (3) - Details of Loss of Certificate / Duplicate Certificate
2024-07-05,Change in RTA,BSE,Announcement under Regulation 30 (LODR)-Change in RTA
2024-07-06,Rating by CRISIL and CARE,BSE,Announcement under Regulation 30 (LODR)-Credit Rating
2024-07-08,Change in RTA,BSE,Announcement under Regulation 30 (LODR)-Newspaper Publication
2024-07-08,Certificate under Reg. 74 (5),BSE,"Compliances-Certificate under Reg. 74 (5) of SEBI (DP) Regulations, 2018"
2024-07-10,Press Release,BSE,Announcement under Regulation 30 (LODR)-Press Release / Media Release
2024-07-10,BIDDING UPDATES,BSE,UPDATES
2024-07-11,Allotment of Bonds,BSE,Announcement under Regulation 30 (LODR)-Allotment
2024-07-20,GRI Certified Sustainability Report FY 2023-24,BSE,GRI Certified Sustainability Report FY 2023-24
2024-07-22,Analyst Meet Post Q1FY25,BSE,Announcement under Regulation 30 (LODR)-Analyst / Investor Meet - Intimation
2024-07-22,"STATE BANK OF INDIAhas informed BSE that the meeting of the Board of Directors of the Company is scheduled on 03/08/2024 ,inter alia, to consider and approve financial results for the quarter ....",BSE,Board Meeting Intimation for Financial Results For The Quarter Ended 30.06.2024
2024-07-24,"Signing of Non-binding MOU with FCDO, UK",BSE,Signing Of Non-Binding Mou With FCDO
2024-07-29,Details of investor meet,BSE,Announcement under Regulation 30 (LODR)-Analyst / Investor Meet - Intimation
2024-07-30,"STATE BANK OF INDIAhas informed BSE that the meeting of the Board of Directors of the Company is scheduled on 03/08/2024 ,inter alia, to consider and approve Update on board meeting 
The ....",BSE,Update on board meeting
2024-07-31,Change in Senior Management,BSE,Change In Senior Management
2024-08-03,Audio Recording of Analyst /Investor Meet,BSE,Announcement under Regulation 30 (LODR)-Analyst / Investor Meet - Outcome
2024-08-03,Statement of Deviation & Variation 30.06.2024,BSE,Statement Of Deviation & Variation
2024-08-03,Investor Presentation Q1FY25,BSE,Announcement under Regulation 30 (LODR)-Investor Presentation
2024-08-03,Financial Results for the quarter ended 30.06.2024,BSE,Financial Results For The Quarter Ended 30.06.2024
2024-08-03,Outcome of Board Meeting - Financial Results and Fund Raising,BSE,Board Meeting Outcome for Outcome Of Board Meeting - Financial Results And Fund Raising
2024-08-03,Financial Results Q1FY25,BSE,Announcement under Regulation 30 (LODR)-Press Release / Media Release
2024-08-05,Newspaper Publication of Financial Results,BSE,Newspaper Publication For Financial Results
2024-08-06,Loss of share certificate,BSE,Compliances-Reg. 39 (3) - Details of Loss of Certificate / Duplicate Certificate
2024-08-06,"Code of Conduct under SEBI (PIT) Regulations, 2015",BSE,Code Of Conduct Under SEBI (PIT) Regulations
2024-08-07,"Interaction organised by Nuvama
Time of Meeting
9 am to 9:50 am SGT
10 am to 10:50 am SGT
2 pm to 2:50 pm SGT
4 pm to 4:50 pm SGT",BSE,Announcement under Regulation 30 (LODR)-Analyst / Investor Meet - Intimation
2024-08-07,"Interaction organised by Nuvama
Time of the meeting
11 am to 11:50 am SGT
1 pm to 1:50 pm SGT",BSE,Announcement under Regulation 30 (LODR)-Analyst / Investor Meet - Intimation
2024-08-07,"Appointment of Shri Challa Sreenivasulu Setty as Chairman, SBI",BSE,Announcement under Regulation 30 (LODR)-Change in Directorate
2024-08-07,"Appointment of Shri Rana Ashutosh Kumar Singh as MD, SBI",BSE,Announcement under Regulation 30 (LODR)-Change in Directorate
2024-08-08,"Brief profile and other details of Shri Rana Ashutosh Kumar Singh, MD",BSE,Announcement under Regulation 30 (LODR)-Change in Directorate
2024-08-08,Sale of stake in Clearing Corporation of India Limited,BSE,Sale Of Stake In CCIL
2024-08-09,Transcript of meeting dated 03.08.2024,BSE,Announcement under Regulation 30 (LODR)-Analyst / Investor Meet - Outcome
2024-08-09,Meeting organized by Motilal Oswal Financial Services Limited,BSE,Announcement under Regulation 30 (LODR)-Analyst / Investor Meet - Intimation
2024-08-12,Investor interaction arranged by Nuvama,BSE,Announcement under Regulation 30 (LODR)-Analyst / Investor Meet - Outcome
2024-08-13,Investor meeting organised by Nuvama at Singapore,BSE,Announcement under Regulation 30 (LODR)-Analyst / Investor Meet - Outcome
2024-08-19,Group Meeting arranged by Motilal Oswal Financial Services Limited,BSE,Announcement under Regulation 30 (LODR)-Analyst / Investor Meet - Outcome
2024-08-21,Credit Rating by India Ratings,BSE,Announcement under Regulation 30 (LODR)-Credit Rating
2024-08-28,"Brief Profile of Shri CS Setty, Chairman, State Bank of India",BSE,Announcement under Regulation 30 (LODR)-Change in Directorate
2024-08-28,Appointment of Chairman,BSE,Announcement under Regulation 30 (LODR)-Change in Directorate
2024-08-28,Updates on Bidding for Basel III Tier 2 Bonds,BSE,Updates On Bidding For The Bank'S Basel III Compliant Tier 2 Bond Issuance
2024-08-28,Press Release,BSE,Announcement under Regulation 30 (LODR)-Press Release / Media Release (Revised)
2024-08-29,Allotment of 7500 Basel III Compliant Tier 2 Bonds in the nature of debentures of face value of Rs. 1 crore each,BSE,Announcement under Regulation 30 (LODR)-Allotment
2024-08-30,Nomination of Shri Nagaraju Maddirala as Nominee Director,BSE,Announcement under Regulation 30 (LODR)-Change in Directorate
2024-08-30,Analyst / Investor meet organised by Elara Securities,BSE,Announcement under Regulation 30 (LODR)-Analyst / Investor Meet - Intimation
2024-09-02,Brief profile of Shri Nagaraju Maddirala,BSE,Announcement under Regulation 30 (LODR)-Change in Directorate
2024-09-02,Loss of share certificate,BSE,Compliances-Reg. 39 (3) - Details of Loss of Certificate / Duplicate Certificate
2024-09-02,Newspaper advertisement for loss of share certificate,BSE,Announcement under Regulation 30 (LODR)-Newspaper Publication
2024-09-04,Investor interaction arranged by Elara Capital,BSE,Announcement under Regulation 30 (LODR)-Analyst / Investor Meet - Outcome
2024-09-05,Interaction with Institutional Investors / Analysts arranged by Morgan Stanley,BSE,Announcement under Regulation 30 (LODR)-Analyst / Investor Meet - Intimation
2024-09-11,Notice for shareholders of the Bank,BSE,Announcement under Regulation 30 (LODR)-Newspaper Publication
2024-09-11,Press Release Bank SBI Indonesia,BSE,Announcement under Regulation 30 (LODR)-Press Release / Media Release
2024-09-11,Investor / Analysts meet arranged by Jefferies,BSE,Announcement under Regulation 30 (LODR)-Analyst / Investor Meet - Intimation
2024-09-11,Credit Rating by CRISIL and CARE,BSE,Announcement under Regulation 30 (LODR)-Credit Rating
